{"bound_digests":{"authoring_report_sha256":"b57990e6f742c978d2e143cb850db43d0f963e021a3454691ebc93a793f2c052","candidate_payload_manifest_sha256":"178abdeee2bb055102e232d15a6b79bd2f3577d3b723a5a33bf7ff7f4db787c9","delta_manifest_sha256":"5267168b8965798462703856a95d605abfda9cb9c8074aee6801fc7ae3a2e486","feedback_ledger_sha256":"56dc332f3c5ffbfdf755f40be6d5c4cfd81e84da40b2e7b18f2e015d6b6850f8","governance_manifest_sha256":"3561f317c02ffbcfa4a4ea0bbdf985d4f835f5e1acf5ba4436ee62775af3a2e6","main_pdf_sha256":"ae8d89e90ece0dcefab83ba44b2fd1e9de73ba7d04abe7501192b085ab652ca0","manual2_pdf_sha256":"7c6bb054137fef78b27f67bb93e0a2e962f99dc0e3c1ee0b4497905159cf176f","manual_pdf_sha256":"19df9a7711861bb0cbc1a5e71491d3b605ff73a4bf05bbf108241b9f3f4c5112","source_tree_delta_manifest_sha256":"64ce47f66dee6d4c55436dbb40d433ca70a273172285cbb4beb86482a80e4c04","tests_sha256":"c5d47b2ace3490a277f07a45f507939ba6b61ddb75012412da08f23a52533bb0"},"candidate_id":"working_candidate_v40_03r23_1_elementary_matter_118_transition_atlas_seed_metadata_sync","candidate_version":"v40.03r23.1","checks":[{"check_id":"bundle_complete_validation","evidence":"tools/validate_complete_bundle.py accepted the AUTHORING opening bundle","status":"passed"},{"check_id":"phase_validation","evidence":"tools/validate_phase_bundle.py accepted active_phase AUTHORING and next transition REVIEW","status":"passed"},{"check_id":"upstream_delta_scope_validation","evidence":"tools/validate_upstream_release_lock.py returned trusted_project_sources_delta_scope_valid","status":"passed"}],"closed_findings":[],"counterfactuals":["No Elementary Matter 118 target values, SI reports, residuals, or scores are introduced in this opening bundle."],"falsification_conditions":["Target joins, SI reports, residuals, scores, empirical comparisons, subject/reference phase locks, or metric report values are opened in the AUTHORING opening bundle."],"finding_resolutions":[],"go_recommended":true,"governing_constraints":["AF_PROTOCOL","AFC_PROCEDURAL_DYNAMICS","AOD_BUNDLE_CYCLE","GI_021_PROJECT_SOURCE_TRUST_BOUNDARY"],"open_findings":[],"provenance":["PAYLOAD_CONTENTS_SHA256.txt","delta/DELTA_MANIFEST.csv","delta/SOURCE_TREE_DELTA_MANIFEST.csv","governance/GOVERNANCE_CONTENTS_SHA256.txt","cycle/FEEDBACK_LEDGER.csv","cycle/AUTHORING_REPORT.json","tests.txt"],"r08_status":"OPEN","record_scope":"bundle_instance","review_id":"review_v40_03r23_1_authoring_opening_carried_review","review_scope":"Carried review binding for AUTHORING opening of the Elementary Matter 118 Transition Atlas Seed; independent review still required after authoring materialization.","reviewer_class":"independent_bundle_reviewer","schema_version":"3.1","verdict":"GO_RECOMMENDED","verdict_reason":"Opening bundle only; canonical validators pass and no target/SI/residual/score lanes are opened."}
